text	label
Srs: Aún estoy esperando la factura. No lo recomiendo a nadie. Duró una semana. Y no tuve nunca la garantía.	negative
NO VALEN PARA E90 del 2008 con xenon! Despues de desmontar rueda, guardabarros y demas ( 45 min ) resulta que no es la bombilla correcta!!!!	negative
Cuidado! No llega nunca y no te devuelven el dinero. Me dijeron que posiblemente se había perdido en la aduana, que me devolvian el dinero, pero eso no es cierto.	negative
El papel entra demasiado justo. Creo que es pequeño	negative
Imposible que lea el codigo QR del movil. La camara viene en su codigo con US de USA. Puse enl a app USA y tambien probe con spain. Pero nada ...no me lo lee...Alguien sabe de que puede ser?	negative
Lo he usado poco y ya me cuesta mucho encenderlo, no me hace chispa. Y como se ha dicho, el fuego mínimo es muy fuerte. No quema bien.	negative
Para lo que cuesta no esta mal, trae cuatro tornillos para colocar debajo de la plancha y así poder nivelarla, el problema es que uno de ellos no entra en el agujero ya que está mal hecho, las instrucciones vienen en chino y tienes tu que indagar el funcionamiento, la parte donde esta el contador de tiempo y temperatura he tenido que desmontarlo ya que venia suelto con los tornillo flojos, es decir un desastre.	negative
Muy buena adquisicion, hace su función con creces	positive
Tiene buena pinta pero el tallaje es pequeñisimo	negative
Como esperaba, estupendas.	positive
La funda es súper Fina , no abulta nada, muy cómoda. Por ponerle un pero es algo resbaladiza, pero buena compra y recomendada.	positive
En mi opinión no volveré a comprar esto se queda todo dentro de la cápsula y lo poco que sale sabe a agua.No lo recomiendo	negative
Muy bien empaquetado y conforme a lo que especifican en el artículo. Perfecto para manualidades.	positive
Ha venido sin el conector rápido.	negative
Me ha encantado esta cuchilla, se me rompió la que venía con la maquina y este reemplazo me ha ayudado mucho. Es igual, por no decir idéntica, a la de que venía de serie con la máquina. 100% recomendable.	positive
Buena calidad y buen precio	positive
La funda está bien pero no encaje a perfección se queda algunos botones como el del sonido y el de apagado tapados	negative
Aguanta el tirón relativamente bien; tu móvil no saldrá volando al primer bache. Sin embargo, sí que aparecerá mirando hacia donde el azar determine, lo cual no deja de ser disfuncional.	negative
Gracioso, ligero, útil y en precio. Muy fácil de montar	positive
Me duró exactamente una semana. Se despegó la ventosa a la semana, se cayó contra el salpicadero y se rompió	negative
No los recomiendo ni los vuelvo a comprar, no me han llegado a durar 3 meses y practicamente sin usarlos. Debe fallar el cable en su union a la clavija	negative
Llevamos muchos años utilizando esta marcha de etiquetadora y es la más duradera para el uso que hacemos.	positive
Me ha llegado con varios daños. Es una pena porque la rueda es muy guay y suave. No voy a devolverlo porque no quiero perder mi tiempo en los correos, pero espero que estos daños no se hacen más graves y la rueda pierde su funcionalidad.	negative
No es ninguna maravilla, pero por lo que cuesta se puede tener para algún uso esporádico, sin más	negative
El producto todavia no me ha llegado, poca profesionalidad.	negative
El producto es lo que esperábamos,el problema fue con el envío,al comprarlo ponía que lo recibiríamos en dos días,en este caso un viernes y lo recibimos el lunes por la tarde	negative
Justo lo que buscaba,se ajusta a lo que dice el vendedor,lo recomiendo	positive
Inflador de aire, va bien para colchones y colchonetas, el tipico INTEX que hay en cada casa de estudiantes. Sin embargo no es un compresor, osea que no lo compres si esperas inflar globos, apra eso necesitas inyectar aire a mucha presión ( aunque no lo parezca) y necesitaras un compresor de aire, no una bomba. Teniendo esto en cuenta del resto va bien, compacto y portatil, simple pero por el precio te ahorra un trabajillo cuando vienen los invitados, no se le puede pedir mucho mas.	positive
La compramos para un niño, decir que la bateria dura apenas 2 horas si llega. Despues al intentar meterla en una funda de protección para niños, al apretar un poco la pantalla se rompio por dentro. Muy muy frágil	negative
Perfecto. Cumple mis espectativas. Espero que resista bien el uso sobretodo porque estará húmedo con frecuencia. Llego a tiempo y muy bien protegido dentro de una bolsa de tela. Lo recomiendo	positive
Aún no he recibido el producto, pese a que estaba previsto que llegara el 19 de febrero. Confío en que llegue antes de Carnaval, ya que lo he comprado precisamente para esa fiesta, con la suficiente antelación.	negative
La utilizo para ir a trabajar y cumple su funcion. Muy comoda y esteticamente bonita	positive
Es lo que buscaba, pero para viajes es un poco grande.	positive
Material de poca calidad	negative
No es el producto pedido, el pedido era cordón de cuero de 2mm y lo recibido es de 1.5 mm.....	negative
El cristal de la cámara no dura nada	positive
Tiene una buena precisión en tensión en todo el rango y el limitador de corriente funciona bien. Un buen producto para el precio que tiene.	positive
Acabo de comprarlo y no puedo acceder al su lectura.	negative
No es un buen protector para que la pantalla no se rompa. Es un film que se puede doblar y cortar, como el film protector con el que vienen de fábrica las tablets o teléfonos.	negative
Indispensable para cualquier labor de tapicería. Sin este destornillador quita grapas y tachuelas me hubiese representado una gran dificultad el reemplazar la tapicería de cuatro sillas.	positive
Me han funcionado perfectamente. Lo he utilizado para un Honda Accord y lo hice sin ningun problema. Quizas me hubiera gustado que las garras fueran un poco mas grandes pero aun así cumplió con su cometido. Muy contento con el producto respecto a calidad - precio.	positive
Las luces funcionan mejor de lo que me esperaba. Tienen dos problemas, el primero que no encaja igual de bien que las de fábrica en mi audi a3 del 2011, y el segundo que los tornillos de las luces originales no sirven para estas.	positive
Llegó 2 días después pero bien encaja para mí campana cata perfecro	positive
Desastre. Tenía entendido que Taurus dejaba que desear y lo he comprado. Devuelta el mismo día: no hace contacto y si fuerzas suena chispazo.	negative
Estoy encanta muy bonita y el material está muy bien me llego justo el día k me dijieron	positive
Cumple de sobra con mis necesidades de cada día.	positive
El envase no se corresponde con la descripción del producto. Entregado con bote plástico+spray	negative
Nefasto, roto a la primera y gracias, ya que de lo contrario y en uso de accidente hubiera tenido un disgusto.	negative
Buen aparato, reproduce (calidad media) como walkman, pero para pasar tus cintas a PC... No sé cómo será, pero a Mac... Difícil, difícil... descargué software, lo intenté, pero no era nada sencillo, no viene nada de ayuda en ese sentido, no es como introducir un CD y extraer las pistas... Chin Pum.	negative
Tiene una apariencia muy similar a la madera. Es de goma flexible y resistente. Añade un plastco para la pantalla. Como punto negativo es algo resbaladiza.	positive
Tal y cómo llegó a casa la devolví. Le pongo 3 estrellas por las facilidades para devolver el producto, pero el producto en sí no me gustó nada. No se conecta a wifi, va con un mando y no lo puedes controlar con una app ni con un asistente tipo Alexa. Sin manual de instalación ni ningún tipo de indicaciones para saber qué es cada terminal.	negative
Mientras que la cafetera parecía nueva, el filtro de dentro (el que tiene la junta de silicona) se veía usado y además estaba golpeado, entiendo que lo habrían sacado y golpeado de alguna forma. Me siento estafado.	negative
Complementa la utilidad de los focos recargables, para espacios sin conexión eléctrica.	positive
Fatal, la batería no dura más de 20 minutos, se apaga cuándo está en porcentajes como 80% o 70%, lo pongo a cargar cuándo se apaga y me pone que está otra vez a esos porcentajes. Es una lotería, me es imposible usarlo sin estar cargando ya que no se cuánto va a durar la batería.	negative
Demasiado pesada. Forma oval	negative
Se da mucho se sí, dejando toda la marca de la muñequera	negative
Malísima valoracio , todavía no lo he recibido desde hace 20 días que tenía que haber llegado , y no me solucionan nada . Nada recomendable	negative
Excelente producto por la sensación de suavidad que deja en la piel y excelente olor. Fácil y cómodo de aplicar, compraré de nuevo el producto. Yo lo aplico en glúteo y piernas. No puedo decir que en tan poco tiempo , un mes, haya visto resultados extraordinarios pero soy una persona paciente con los tratamientos así que seguiré con ello . Producto barato y fácil de uso; y tampoco he visto ninguna contraindicación o efecto negativo en mi piel . Un saludo!	positive
Decepcionante en cuanto a las facilidades de montaje. Es Extremadamente fino. Para que quede un poco rígido hay que ponerle ganchitos en todas las posiciones y solo te mandan unos poquitos con los que no tienes ni para empezar.	negative
ASICS siempre una talla más a la que tienes habitualmente. Debería ponerlo en la foto.	negative
Lo hemos comprado hace un mes no aspira bien la bateria no aguanta nada menos de 30 min y tiene que estar cargando 24 horas	negative
Se atasco con la primera hoja. Tuvimos que devolverlo.	negative
una replica de m****a!no dura nada!por lo menos que ponga con 5€ no con 32€ como el original!voy a dejar de comprar colonias en amazon...	negative
Funcionamiento perfecto, se escuchan muy bien.	positive
No sé si lo hago mal. Me gusta como queda en apariencia pero la verdad es que el pelo me resulta difícil de peinar después de usarlo. Lo quedo liso tras peinarme sufriendo de tirones. Mi valoración es positiva porque es lo que ofrece. Cera de color blanca para el pelo.	positive
El papel es muy fino y el rollo es muy pequeño	negative
Una de las baterias no carga	negative
El móvil hay que situarlo de una manera muy concreta para qu cargue. Tengo otra base más pequeña y va mejor. No lo recomiendo.	negative
La llevo súper cómoda. No pesa nada, no sé desabrocha por el tipo de cierre que tiene y es muy bonita.	positive
A LA FECHA DE HOY 07 DE AGOSTO DEL 2018 NO HE RECIBIDO ESTE ARTICULO	negative
De buena calidad y parece resistente. Lo único, necesita mas capacidad para el agua. Se les termina muy pronto ya que cada chorro consume bastante y hay que estar llenando a menudo. Para abrir la tapa, hay que girarla un poco y levantar.	positive
Esta muy bien para el precio.	positive
Muy bonitas y de calidad perfecta	positive
Después de días esperando me llega el producto en una caja de cartón rota y el láser echo un asco.. Solicito la devolución.. Y aquí viene la odisea porque es un vendedor externo.. Después de tantos mensajes acordamos que me envía otro.. Un mes después aún lo estoy esperando.. No sé como permite esto amazon.. Muy descontento	negative
Me esperaba que tuviera más calidad es difícil de poner y queda pompas de aire por mucho que apriete	negative
No me han llegado a durar dos meses cada par andando descalzo sobre suelo de parquet. No repetiría.	negative
El molinillo viene con una pestaña de la tapa inferior de cierre rota, por lo que todas las piezas están desmontadas. No encuentro la forma de montarlo. Necesito que me indiquen como deben colocarse las agujas para que coincidan bien las ruedas dentadas. Si no, devuelvo el producto.	negative
La compre para un viaje en concreto y por ese precio la verdad que no se puede pedir mas por menos	positive
En Noviembre compré el reloj para poder usarlo en las clases de natación, ya que se supone que es un reloj apto para ello, pero ya no funciona correctamente. Cargamos el reloj y aunque indica carga Full, no es correcto, ya que a los pocos minutos de ponerlo en la muñeca se apaga. Además, que cada vez que se apaga,al encenderlo tienes que volver a configurarlo desde cero. Estamos muy descontentos con el producto, hacemos bastantes compras en Amazon, y es la primera vez que nos ocurre salvo así.	negative
El servicio de Reparto de seur es muy pésimo. Lo ha dejado en un punto de Recogida alegando de que no estaba en casa.todo es mentira si estaba en casa.	negative
Me ha solucionado los problemas	positive
La calidad del producto es muy buena, sin problemas para instalarlo, teclas con suavidad y el ratón preciso y silencioso.	positive
Producto de calidad sencilla al tanto y a imagen	negative
La primera vez que fallas el tiro, la peonza se raya completamente. Una vez que la bailes al revés, lo cual es muy habitual, se descascarilla todo el plástico superior. La compré de metal porque el plástico me parecía endeble, pero gastarse 25€ en un trompo que media hora después de dejárselo a un niño, parece que está para tirar... Me arrepiento de no haber comprado uno de madera de 2 euros.	negative
... Y no me importaría pagar mas. Para empezar, el transformador de poca calidad junto con el cable, el aparato igual, plásticos baratos con botoneras muy deficientes y pequeños para ser un dispositivo que tienes en la mesita de noche de la cama, cuanto tienes la radio puesta o el sistema inalámbrico para conectar el móvil ¡NO SE VE LA HORA!... El sonido muy deficiente; un aparato con sistema de carga QI se merece más calidad acorde con los usuarios de este tipo de dispositivos de gama media/alta.	negative
semillas diminutas, no se si es semilla o la piel de las mismas, está tan molido que no se aprecia nada.	negative
Horrible y peor servicio tuve que ir a correos a por el, ya que no lo acepte, lo rechazo y aun así me lo cobraron, ahora estoy con un producto que rechaze al minuto de pedirlo y que me gusta, devolverlo me cuesta dinero... En fin	negative
Producto muy bueno, corta bien, no da tirones y viene con accesorios muy útiles, en proporción a lo que cuesta muy buen producto	positive
El artículo son 5 libretas con gusanillo. Pero sólo ha llegado una. Lo he devuelto. Estoy un poco molesto. Lo compras aquí para no tener que ir a la tienda y al final pierdes más tiempo. Tengo que imprimir la etiqueta y quedar con el mensajero o peor aún ir a la oficina de transporte. Si son 5 libretas no se por qué envían una!	negative
No creo q sirva para mucho.	negative
Son enormes, si tienes cara fina, como yo, te comento toda la cara. A mí no me gustaron y las devolví. No sientan como esperaba	negative
perfecto en sensibilidad y en comodidad y como no en entrega.	positive
Mi madre me lo pidió para depilarse los pleitos sueltos que le salen por la cara.. es muy fácil de usar.. llevar una pila.. con lo cual lo puedes llevar en el bolso.. llegó muy rápido.. bien embalado y presentado.	positive
Queria la alfombra para pones sobre el cesped artificial, el viento la levanta pq s muy ligera, hay k sujetarla con piedras y la petra al pasar por encima con sus garras me la agujerea, poco me va a durar.	negative
Buena calidad de la navaja, viene con cuchillas dobles y simples. Es cómoda y buen diseño en relación al precio. El peine-molde es de plástico y cumple su función. Buena compra calidad - precio	positive
Lo esperado. Comprado por comodidad, pero sale caro con los gastos de envío.	negative
No funciona la batería en la psp de ninguna manera, y es la suya, nada que hacer, se carga pero no va	negative
Igual que el que jugamos. No lo encontré en ningún sitio... Solo aquí. Muchas gracias. Es muy entretenido para los niños y mayores.	positive
un poco cara de precio pero cumple su funcion	positive
La tinta de las flores destiñe	negative
Fácil instalación y posibilidad de montar dos cámaras, aunque en mi caso solo utilizo una. No es posible visualizar las dos cámaras a la vez en la pantalla, aunque se conmuta la imagen cada vez que se activa la marcha-atrás.	positive
Se mueve mucho cuando lo pones en la boca	negative
Para empezar, el vendedor no me dió ningún tipo de número de localización para saber por donde iba el paquete, tuve que pedirlo yo. El funko llegó en una bolsa de plástico sin ningún tipo de protección y cuando la abro, la caja viene totalmente rota y arrugada, por suerte el funko estaba bien pero el embalaje fue horrible, se puede ver en las fotos. Le doy una estrella y porque no le puedo dar menos	negative
Bien. Es como se describe.	positive
todo según marca el producto	positive
Mi mujer esta encantada, dice que despues del verano con los pies como se le habian quedado con durezas y secos , este exfoliante le ha parecido muy bueno, es suave pero te quita las celulas muertas en cuestion de nada. A parte que la verdad, huele de un bien... tiene que tener algun elemento refrescante porque deja los pies como fresquitos, ademas hemos usado muy poco, cunde mucho. Estamos contentos con la compra y compraremos mas cuando se acabe.	positive
Facil de instalar y muy resistentes. Soportan bien el peso y no se despegan a pesar de ser pequeños.. Los recomiendo.	positive
llego mas tarde de lo qeu tenia que llegar y encima eran anillas de llavero de las normales redondas i de lo mas feas que hay nada qeu ver con las de la imagen planitas que dan una sensacion de calidad con acabado cromado	negative
la verdad es que no esta mal ideado , pero a mi no me gusta , se ve mucho en el reloj y para mi lo encuentro feo,	negative
La sensibilidad de la pantalla con este protector es muy mala.	negative
Es perfecto para guardar un móvil y evitarle golpes.	positive
De momento bien, veremos en un tiempo si cumple	positive
Llego rápido y funciona fenomenal la pulsera, la recomiendo	positive
Nefasto! Usan la peor agencia de transportes del mundo! El producto les va a llegar roto si o si. Busquen cualquier otro proveedor que seguro les dará mucho mejor resultado tanto en calidad, servicio y sobre todo atencion post venta	negative
Es tal cual se muestra en la foto. Y son bastante grandecitos como para meter cosas dentro. Son de tacto suave y bonitos. Muy útil que traiga colgadores para poder colgarlos sin ningún tipo de dificultad. Estoy deseando que llegue la navidad para ponerlos!	positive
me a gustado mucho es muy bueno estoy muy contenta	positive
Funciona pero necesitas el cargador (que no es de iPhone)...un poco lío ya que creía que funcionaba directamente conectado al iPhone...aun no lo he podido utilizar para lo que quería	negative
Muy bonito tapiz, lo recomiendo para espacios alegres y llenos de luz.	positive
Lo usé para la fiesta de cumpleaños de un niño les encantó	positive
No era el producto que pedíamos y no he podido devolverlo porque la tienda no contesta a los mensajes	negative
De momento funciona bien, es lo que esperaba. Ya he tenido varios y duran lo que duran. pero estoy contenta con la compra. un saludo	positive
Se oye antes y mas fuerte a Alexa, dando aviso de llamada. Solo lo compraría para una casa muy grande.	negative
Se adapta perfectamente al producto. Pero el precio es algo elevado	positive
bonito diseño, buen material, después de tiempo de uso esta como el primer día	positive
Aun no he jugado a Estel juego, pero al abrirlo las ilustraciones de las cartas no son ni parecidas a los personajes de verdad	negative
La caja es con brillo, y si la miras al trasluz está con rayas.	negative
de lejos se nota de verdad se brilla	positive
es tal cual la foto y facil de montar	positive
Lo voy a devolver directamente. Porque no esta presentable para regalarlo en estas condiciones.	negative
Muy bueno para piel atópica.	positive
Si bien la batería llegó en perfecto estado y funcionando correctamente esperé durante casi 10 días para recibirla, desde una ciudad que está a 2 horas en coche.	negative
Yo compre todo el equipo taladro de TACKLIFE por su poco peso ,se adapta a las personas mayores, y una batería mas ,calidad en comparación de precio es un regalo ,esta herramienta estuvo en rebaja en amazon mucho tiempo	positive
No tienen un buen pegamento, solo un poco de calor y se despega ,y mala textura, además de muy estrechos, mejor de 19mm. Arrepentido de la compra.	negative
Aun no me ha llegado el paquete, tarda mucho y ya ha superado en 6 dias el tiempo estimado de entrega.	negative
Lo compré para regalo, lo cual lo tuve un par de semanas envuelto...para sorpresa de que venía con error de fábrica, el cinturon estaba al revés y es imposible girarlo porque viene pegado al traje...	negative
Es mas seguro que el original	positive
Ligerito, fácil de llevar si sales de viaje y es bastante potente, varias velocidades aunque la temperatura es algo alta.	positive
Pequeño, no me entra el móvil	negative
Me han enviado un artículo de segunda mano con grasa y migas en la base del producto l, en vez de uno nuevo. Venia en caja abierta sin envoltorio de Amazon.	negative
no vale para nada la usado una vez para purgar los frenos de mi coche ni siquiera e podido terminar es un juguete	negative
Muy buena opción para suprimir bidé, que he utilizado desde niño y éste grifo lo suple sobradamente. La instalación por mi, que soy un manazas, ha quedado perfecta. Lo único que he tenido comprar en fontanería un pequeño latiguillo para la cisterna que me ha costado 1€. Mi mujer también opina lo mismo.	positive
El contador no funciona... hace ruido pero no cuenta las vueltas. El paquete llegó bien, en tiempo. Pero el reloj no funciona.	negative
Estoy a la espera que aún venga la empresa de mensajería para iniciar la devolución	negative
Uno de los mejores inventos de la historia XD	positive
Depende demasiado de la intensidad de sol	negative
Probado durante tres meses. Buena estética y acabado de trabajos. Fácil de usar. Los trabajos a realizar serán algo lentos ya que rellenar todos los huecos que trae es lento, pero el resultado final es estéticamente muy bonito y poco visto. Yo opté por dar pigmento y rellenar juntas con arena y cemento en seco. Única pega: dificultad para lavar después de cada jornada ya que son muchos huecos y muy pequeños	positive
Geniales calidad/precio Lamentablemente se le ha ido todo el tinte azul y ya es imposible de ver bien, han durado muy poco y la buena impresión inicial se ha vuelto malísima. A comprar otras.	negative
Me ha gustado mucho el diseno. Sencillo y elegante. Cumple su función perfectamente por un precio muy bueno. Por ahora no tengo quejas de su funcionamiento. Muy facil de limpiar	positive
El producto me ha llegado con la caja rota. Saludos	negative
Los vendeis con defectos	negative
Los bordes no se quedan pegados y deja parte de la pantalla sin cubrir, cosa de la que no te das cuenta hasta que lo instalas y entonces ya no se puede devolver..muy mal, no lo recomiendo	negative
No tiene 24000 nunca! No carga 2 veces un móvil. Fatal, no lo compréis!!!	negative
Buen producto y excelente trato del vendedor. Recomendable al 100%. Le solicite al vendedor las instrucciones en castellano y sin demora me las envío al correo electrónico.	positive
Calidad precio muy bien y capacidad tambien lo que app no funciona	positive
Tal y como se describe. Llegó mucho antes de lo esperado, así que encantados con la compra.	positive
Estoy muy contento con la compra. Llegaron bien embalados y a tiempo. De buena calidad. Recomiendo compra por calidad precio.	positive
Todo perfecto, tal y como indica	positive
La descripción dice que es compatible con el Samsung Galaxy J5 pero le va pequeño, la pantalla es más grande que el cristal. No es compatible. He solicitado la devolución	negative
Les he tenido que quitar la plantillas porque se movían y eran incómodas	negative
Desde q la compré no he tenido ningún problema. Es sencilla y fácil de usar. Me gusta sobre todo porque el aparato para meter la cápsula va a parte.	positive
Funciona pero no con todos los cables	positive
Es muy práctico. No es el color que pedí.	negative
Se despega al momento, lo compre para camuflar un objetivo fotográfico. Al final es barato el producto pero sale caro porque no pega.!!	negative
Contra: Es bastante pequeño, no cabe medio litro de agua. No se puede elegir el color de la luz LED; ésta va cambiando cada pocos segundos. Caro para lo que es. Pro: Sale bastante vapor.	negative
El libro en sí es original y esta divertido, pero su funcionamiento... las solapas que han de salir estan duras y al ser carton hay que gastar cuidado, algunas páginas venian pegadas entre sí y el libro algo deteriorado. Este es el segundo, pues el primero estaba peor y encima una de las solapas estaba rota, por que solicité un cambio y amazon como siempre increibles en el trato al cliente	negative
Comodo, buena visibilidad y sumergible. la brujula funciona bien. El termometro hay que usarlo con el reloj quitado y asi y todo no es muy fiable, aunque hay una opción para ajustar la temperatura a la de un termometro fiable.	positive
La funda encaje muy bien y protege el reloj, solo espero que no cambie de color como la anterior que tenía, que paso de transparente a amarillenta a los pocos meses de tenerla.	positive
No es el cepillo de mayor potencia que he tenido pero por relación calidad precio va fenomenal.	positive
Perfecto. Tal como se describe. Ideal para encenderlo en zonas con viento. Ligero. Se recarga con el cable del movil, un miniusb normal .	positive
La piscina es preciosa y nos llegó antes de lo previsto. El único problema es que está rajada.. :-(	positive
No ha durado ni un año. Aunque mientras duró molaba mucho.	negative
No está mal, quizás un poco tiesa, pero me vale para lo que la compré. Perfecta para un mástil.	positive
le doy 2 estrellas por que para mi octavia del 2005, los tapones para los tornillos normales van bien, pero el de la tuerca de seguridad es mas grande (y eso que es la original). una pena!!!	negative
