text	label
Buena calidad. Muchos compartimentos interiores y exteriores. Bien acabada. Tela de calidad y detalles. Muy recomendable para llevar tecnología en ella.	positive
Nunca me llego el pedido!Vendedor poco serio.	negative
Fue un regalo para mi padre y está contento,le da un servicio que necesita.la única pega que tarda en calentar.	positive
Protege de golpes pero para monitorizar el rato de natación lo tengo que quitar porque no se accede bien a los botones y tampoco funciona bien la pantalla táctil. Se mete agua entre el reloj y el protector. Para proteger de golpes habría servido el otro más barato. Compré este porque lo ponían muy bien pero mi experiencia no ha sido muy buen	negative
Son muy resistentes , perfecto tamaño para el coche , la carga es rápida	positive
Totalmente decepcionado. Hace ruido, no calienta y venia usado.	negative
Me encantó el producto!! Pensaba que podía ser un poco pequeño o incómodo pero es excelente! El tamaño es genial, caben incluso dos personas adultas de manera cómoda. Es el flotador que más me ha gustado hasta el momento y que más he utilizado. La única pega que podría poner es que no estás nada en contacto con el agua, en mi caso me gustaría que tuviese un área más sumergible.	positive
Todo perfecto. Regalo para mi pequeña que se la pone en bucle	positive
no sirve para nada, no es ni bonito ni gracioso, cuando esta en tus manos es una aberración, ademas de mala calidad el morro se sale y los detalles son pintura y mal acabados, además huele mal.	negative
Bonita lampara de mesa, hace su trabajo aunque la luz no sea muy fuerte pero al mismo tiempo se descarga muy rapido. Habria que dejarla enchufada todo el tiempo.	positive
Fatal. Nunca lo recibí y me hacía mucha falta. Tuve que pedir un reembolso. Una vergüenza. Tengo contratado Prime y no lo recibí al día siguiente, si no pueden ofrecer este servicio que no lo oferten.	negative
Acabo de recibirla y ya voy a llama para hacer la devolución porque me llego usada en ningún lado me decía que era usada y rota y la caja abierta	negative
Son de tacto muy suave,a mi bebé le sirve para después de comer que vomita la leche,absorbe muy bien	positive
Todo bien .producto perfecto se ajusta a lo pedido. Super rápido un día en llegar . Muy contento con la compra .	positive
Es una lástima que haya tenido que devolverlo, pues se reiniciaba cada tres ó cuatro minutos mientras veía una peli. Eso sí, Amazon funciona de miedo...ningún problema con la devolución.	negative
Viene empaquetado en una bolsa, sin caja y sin cable. El cargador de arriba y el de la izquierda es el original, que viene en caja Samsung blanca, precintado, con pegatina 3D de Samsung original y viene con cable. Ambos vendidos por Amazon.es	negative
La ducha es tal y como se ve en la imagen, de calidad buena pero no me avisaron de que venía el pedido como con otros, eso si llego antes de lo previsto	positive
Según ponía en las características, pues a oscuras no se ve nada. Las instrucciones sólo vienen en Inglés y alemán, por lo que no sé como usar la esfera 24 horas para poner el uso horario de otra ciudad.	negative
Estoy muy contenta con esta funda, es muy muy bonita.	positive
Es de lo peor que he comprado nunca por amazon. Eatos auriculares son horriblemente malos. 1. Mal sonido 2. Al hablar por telefono el otro no te oye bien 3. La batería no dura nada 4. Son muy grandes e incomodos En definitiva. Dinero tirado a la basura!!!	negative
No funciona. Es un timo total. Me hace marcas y no cumple con su función, vale mas la pena gastarte un poco mas y comprar algo que si vas a poder utilizar.	negative
la correa del cinturon un poco corta me he tenido que comprar una aparte y la tela muy tiesa pero con un par de usos ya es mas docil y va muy bien	positive
Cero estrellas Es una auténtica porqueria y ya no solo por los materiales que por 3€ que vas a esperar pero al menos que los cactus estén derechos no? Que están tumbados! Madre mía... 🤦🏼‍♀️	negative
Llegó muy sucio impresentable	negative
Cumple con las expectativas...muy a gusto con la compra...tiene mucho espacio y es fácil de transportar. Muy recomendable para regalar.	positive
No lo compréis pues las tallas no tienen nada que ver con la realidad y cuando vas a hacer la devolución a China resulta que vale más el envío que el producto . Muy disconforme.	negative
Cómodas, buen tejido, finas pero cuesta de quitar las manchas. Es tamaño salvaslip.	positive
No ha llegado en las fechas precisas y no dan solución alguna para que me lo entreguen ya o devuelvan inmediatamente su dinero	negative
Mala calidad. No hemos podido ni estrenarla	negative
El ser humano es pura contradicción. Puede amar odiando, reír llorando, sufrir disfrutando. Todo individualmente, todo a la vez. Alejandro nos pone frente al espejo de nuestras inseguridades, pasiones, deseos, anhelos,, de nuestras virtudes, que son al final, nuestros defectos, nuestras contradicciones.	positive
Me encanta lego duplo, y a mis peques tambien. Recomiendo este tipo de juguete totalmente, facil de encajar para los mas pequeños.	positive
Cargó bien durante la primera semana. Desde entonces, funciona cuando le parece, muevas los cables, conectes o desconectes, carga a ratos. Supongo que acabará por fallar de manera definitiva. Mala compra, reclamaré para solicitar garantía.	negative
Increíble muy aconsejable	positive
Despues de 2 meses escasos de uso, acabo de darme cuenta de que el soporte central se ha hundido de forma considerable. Si sigue a este paso en un mes mas, tocara el suelo, y sera totalmente inutilizable. Un desastre. Espero que se pongan en contacto conmigo los vendedores para darme una solucion.	negative
El color chocolate muy oscuro, casi negro es muy elegante y absorbe genial el agua. Se lava perfectamente en la lavadora.	positive
Cómo se ve en la foto	positive
Es pequeño y barato pero bastante cutre el mecanismo para bajar y subir los personajes y no se suben y se bajan bien. Podían haber buscado otra forma como en el que no es de viaje.	negative
Trituradora de papel buena. Tritura muy bien, pero está enfocada para las tareas típicas de una casa. Algunos recibos, alguna que otra carta etc. No se le puede meter mucho de golpe, pues el motor se satura y puede quemarse. Es conveniente engrasar las cuchillas de vez en cuando.	positive
En esta ocasión me he encontrado nudos en la bobina en varios recorridos del filamento, lo que ello implica que pierdes algunas piezas a medio imprimir. Es la primera vez que en esta marca me encuentro con este problema. Tengo otra bobina y espero que no tenga este problema.	negative
Funciona bien y no se aprecia la camara. Puedes cambiar el tipo de resolución del video y carga de verdad el teléfono. La aplicación es fácil de utilizar, me permite ver el vídeo online o ver lo que tengo grabado en la memoria.	positive
Buena compra, de hecho estoy meditando adquirir dos personajes más de Juego de tronos.	positive
Son un desastre llevo un mes para que me digan que pasa con mi teléfono y nada. Se lo envié porque se quedó bloqueado y nada sigo sin teléfono.	negative
Perfecto para meter muchas fotos, cada foto va protegida por su plástico individual.	positive
En una de las imagines indica 19 cm y no es real. También indica muñeca y es una figura. Deberían modificar la descripción ya que la utilidad no es la misma.	negative
Es bastante bueno, elegante y cómodo. No conozco otros, pero este está bastante bien.	positive
Mi hija de 7 años lo tiene siempre cerca cuando va a hacer las tareas. Un imprescidible para estudiantes de inglés.	positive
en la descripción lo venden como si fuese cristal templado y eso es falso es de plástico, pero bueno encaja bien y por lo menos algún arañazo protegerá.	negative
Se despega y no reconoce bien la pantalla táctil, 10€ tirados a la basura.	negative
Es bastante bueno por el precio que tiene las calidades son buenas, más que aceptable. No dudaría en volver a comprarlo.	positive
Cumple con lo anunciado	positive
A pesar de ser de cristal, llegó en perfecto estado	positive
La verdad es que estoy contenta. Es fuerte y queda en su sitio. Eso sí, lo que hace es recoger un poco, no esperes que te va a dejar plana porque eso es imposible.	positive
La mochila es preciosa, justo del tamaño que la buscaba ni muy grande ni muy pequeña.	positive
Son muy chulas y baratas le doy un 10	positive
Funciona tal y como se esperaba. Llego en tiempo indicado.	positive
Es una basura y no funciona	negative
no funciona corectamente, no hace foto, me perdi las piezas de reloj y ahora no esta tan presentable. no recomiendo	negative
Dura muy Dura muy poco la batería pésimo sonido la Dura muy poco la batería pésimo sonido Dura muy poco la batería pésimo sonido sonido	negative
Calidad muy regular para coser a máquina, a mano sí dan el pego. Depende de para qué los necesites valen la pena o no...	negative
Dió tres puntadas , y nunca mas volvió a coser.He visto videos en internet, y está correctamente enhebrada.No la recomiendo	negative
Muy buen tripode para uso prefesional. Buena marca, robusto y la cabeza va muy fluida. Lo utilizo con una blackmagic cinema 4k que pesa unos 4kg + el objetivo que seran unos 0,4 kilos y va perfecto.	positive
Compré 2 para el maletero de mi Cali Ocean y casa con el espacio, quedando un pequeño hueco para las almohadas	positive
Es una estafa, el producto nunca llega y tampoco contestan a los mail! No comprar!	negative
Me ha gustado mucho, deja el pelo muy bien. Lo tengo teñido y dañado, y he probado casi todas las marcas buenas. Repetiré. Es la segunda vez que la pido.	positive
Horribles, al final lo barato sale caro. No entiendo las buenas opiniones, porque en mi caso tuve que devolverlos ya que en el primer fin de semana de uso se estropearon y entraba el agua sin problemas.	negative
Nos han encantado su buena apariencia y su calidad. Viene con unas cintas ajustables para las patas que impiden se las pueda llevar el viento. Parecen hechas a medida para un tresillo chino que compramos en un almacén de origen americano. Tienen unas asas para facilitar su colocación y unos bolsillos que esconden aireadores con redecilla para ventilar.	positive
Un juego muy caro para ser muy simple. Mala calidad de las cartas se estropean en seguida. Nada recomendable su compra	negative
El producto me llegó nuevo, en su embalaje en perfecto estado y con los accesorios correspondientes (cargador y auriculares) Nunca antes había tenido un iPhone, pero lo compré por el precio, pese a ser de 2015. Me sorprende lo bien y rápido que responde teniendo la ultima versión de iOS. El único pero, es que pese a que indica que la capacidad de la batería está al 100%, parece que se descarga muy rápido. Aun así, para ser mi primer iPhone, muy satisfecho con la compra.	positive
No vale para la yamaha Majesty 400 como compré. No me vale para nada. No encaja con los tornillos originales	negative
Muy profesional, se acopla al oído perfectamente y da un aspecto muy serio y profesional, me ha impresionado la calidad del sonido. Trabajo en una empresa que utilizo mucho el teléfono y todos mis compañeros me han preguntado donde lo encontré pero más se han sorprendido cuando les he dicho el precio, tiene un precio mucho más económico que otras marcas y la verdad no veo la diferencia habiendo probado ya varios. El cable del micrófono es flexible y además rota desde el origen verticalmente y horizontalmente.	positive
Son muy malas. Sobra funda por todos lados, se inflan al colocar el disco junto a los demás en la estantería y resbalan mucho. Hay otras mucho mejores y poco más caras.	negative
No me ha gustado del todo. Para tostar pan, olvidaros, mejor usar una tostadora de toda la vida y para sandwiches está bien, lo mejor de todo es que es fácil de limpiar, aunque si pones un sandwich con queso (por ejemplo) el queso se va a seguir metiendo en el mecanismo que une las dos partes, como en todas las sandwicheras. De potencia anda floja. No la devuelvo porque ya la he usado (una vez) pero no la recomiendo.	negative
La rapidez del envío, el libro es para un sobrino	positive
Buena relación calidad-precio. Solo una pega y es que son algo más grandes que los auriculares originales y pasado un rato pueden hacer daño en la oreja.	positive
Hay que ser constantes y los resultados llevan su tiempo, ni tan blanco nieve ni como los tenias antes	positive
Se ajustaba lo descrito pero tampoco del otro mundo	positive
Es un timo, no vale para Samsung s7, no lleva la curva que cubre toda la pantalla. No vale para Samsung S7.	negative
La pulsera llegó rota. Era un regalo y quedé fatal. No lo recomiendo a nadie.	negative
Tome la temperatura de mi bebe 3 veces seguidas y 3 temperaturas distintas daba. Lo mismo hice con mi marido y conmigo, no coinciden nunca y da hasta 1,5 grados de diferencia. Necesito algo preciso para mi bebe de 2 meses. Lo he tenido que devolver	negative
Un desastre es la segunda vez que pido mi guitarra y no me traen! Un desastre!!	negative
A no ser que seas experto en vinilos y demas pegatinas grandes, es muy complicado ponerlo, no vienen instrucciones, una vez despegado ya no pega, quedan muchisimas burbujas lo pongas como lo pongas y en el momento de pegarlo si le das con la uña mismo deja rallas, totalmente decepcionada.	negative
Lo compre para el cumpleaños de mi sobrino y fue todo un exito, lo recomiendo llego en el tiempo estimado.	positive
Brillo da, pero como jabón no sirve, no hace nada de espuma, cero, vamos...Yo lo he usado tras lavar con pistola de espuma, que sino....hago una guarrería, es como lavar con cera. voy a intentar devolverlo	negative
Al mes de comprarlo se me rompió la tecla de R1 y ahora tengo un bonito pisapapeles naranja.	negative
Libro de bolsillo, de pasta blanda. bien encuadernado. Y con la portada ilustrada. Es el que estaba buscando para el niño.	positive
Aunque es un buen producto el que me llegó parecía que había perdido propiedades. No olía al producto original ni el pelo queda sedoso. Parece cómo si estuviese pasado.	negative
Es entretenido pero no es como el juego que yo conocía. Las caras no se enganchan bien entre si. Practicamente, solo puedes hacer cuadrados o formas rectangulares,más o menos grandes, pero sueltas ya que al intentar engancharlas se sueltan.	negative
Lo esperado. Muy útil.	positive
El producto está bien, dentro de mis esperarías dentro del importe. He de decir que una vez recibido me resultó un precio muy alto a diferencia de otros productos de la misma línea, pero aceptable... Por otro lado y totalmente mal es recibir el mapa de GPS para usarlo en la pantalla y ver q el formato en el q viene el mapa GPS no es capaz de ser reconocido por la pantalla en cuestión... Saludos	negative
Llego liado como una alfombra lo deje unas 48 horas para que cogiera su estado normal. Para dormir uno todavía ya que te hace dormir en medio de la cama. Pero para dos no sirve, ya que hace que las dos personas caigan en medio imposible ponerte solo en un lateral. No recomendado	negative
Me ha llegado un día antes de la fecha prevista	positive
Demasiado pequeño. Apenas se puede leer	negative
Lleva dos días de retraso y ninguna explicación	negative
La funda es bonita y es tal como dice SLIM, pero dura poco. A mi hija se le cayo y se le rompio. Si no se te cae el mobil queda muy bien. Pero si no, mejor buscar que no sea de plastico tan fino.	positive
Hace tiempo compré este rascador y todavía lo tienen practicamente nuevo, y son dos gatas con muchas ganas de arañar. El color es muy bonito y la relación calidad-precio es muy buena. Sin duda alguna repetiré.	positive
Fue para un regalo y le encantó. Es un buen producto, llegó en perfecto estado	positive
Perfecto por el precio que tiene y el uso que le voy a dar es una maravilla recomendable 100%. La tela es muy suave y no pican para nada	positive
El producto llegó en perfectas condiciones. Facil de usar y con multitud de programa de lavados. Los lavados son algo largos si no utilizas el programa corto, pero por lo demás, todo perfecto.	positive
Después de pedir el producto, recibir color equivocado, devolverlo, contactar con el vendedor no recibir ninguna respuesta, volver a pedir, y volver a recibir el color equivocado me rendí, lo devolví ñor segunda vez, no puedo opinar sobre la calidad pero se ve normal, tarima de plástico imitación madera	negative
Faltaban 3 tornillos con sus tuercas y eso que venía bien precintado! He montado con unos del Leroy y ha quedado bien ajustado aunque todavía está sin probar con carga.	positive
La montura se ve recia y resistente, llevo poco tiempo con ellas pero parece que van a ser de larga duración y muy económicas.	positive
O me ha durado nada.ya la he cambiado por otra	negative
Algunos cartuchos la impresora no los cogía y los he tenido que tirar directamente, pero también es verdad que me costaron poco, por lo que no me ha molestado en exceso, pues es una impresora con más de 10 años y te sale esto más barato que comprar algo nuevo.	negative
Lo compré para mi Xiaomi Mi 9 y todo perfecto, fácil de instalar y buena calidad. Los recomiendo.	positive
Por el precio que tienen esperaba que no fueran especialmente buenas. Son demasiado rígidas y el mango se despega fácilmente.	negative
Lamentable experiencia debido a sus problemas de conectividad con la app. He comprado la versión sobremesa de este altavoz y al encenderlo y actualizar el firmware la app no lo encuentra. Lo peor es que lo he cambiado por otro y pasa exactamente igual, en cuanto lo actualizas de error. Un altavoz de esta marca y este precio no puede tener estos fallos... Lamentable	negative
Le pongo dos estrellas por qué no cubre en su totalidad la pantalla (no sobresale) el tacto es algo deslizante , la original que regalan con el teléfono se agarra mucho más.	negative
La talla L es correcta para 1.85 y 85 kg. Las mangas quizá un poco ancha pero nada que objetar.	positive
La sincronización era muy mala y poco alcance del bluetooth, deficiente	negative
Me ha decepcionado totalmente, no trae goma ajustable, tienes q atarlo con unos cordones y en las 4 esquinas no trae siquiera. Con lo que si hace viento se destapa continuamente. Además es de mala calidad, muy fino. Realmente no sirve para nada	negative
El mejor soporte de mesa que he usado para móvil. Elegante, se nota muy buena calidad y lo que más me gusta es que es portátil y viene con su funda para llevar. Me gustó tanto que compré otro para regalar.	positive
Es práctico para dejar los auriculares aunque me parece caro para ser tan simple,está bien cumple su función	positive
El producto parece bueno, pero la caja me ha venido en parte empapada, creo que por mal sellado del tapón, porque la botella no estaba rota, y venía bastante protegida. Es una pena, porque se ha desperdiciado bastante producto.	negative
Es el segundo libro de Ana Elena Pena que pido y cada vez me gusta más. Sin duda una de mis autoras favoritas. El libro es pequeñito para poder llevar en el bolso y se devora rápido.	positive
Por lo que me ha dicho la persona a la que se lo regalé, salen los gofres un poco sosos	negative
Me encantó, muy bonito y parecido a Hugo. De todos los funkos que hay de la serie es el que más me gusta.	positive
Lo tuve que devolver no le entraba corriente a la batidora, quizás pudo ser problema del cable, según leí en las instrucciones.	negative
El tacto es suave, a mi hijo y a mi nos encanta!	positive
Contenta con el producto, hace su función.	positive
Al principio pensé que no funcionaria, pasaron 2 días y no había caído, pero al tercer día ahí estaba el ratón, atrapado dentro y en perfecto estado, luego pude soltarlo en otra parte, cumple perfectamente su cometido.	positive
Me ha llegado abierto y aplastado >:(	positive
Esta bien, lo uso para colgar la bicicleta de montaña y va bien. Eso si, a la hora de instalarlo aconsejo usar otros tacos diferentes a los que trae	positive
Muy buena experiencia 100 % recomendable	positive
Lo recibí ayer y hoy lo devuelvo. En sí, no está mal pero a mí no me funciona bien. No se escucha los juegos que trae ni las películas del USB. La pantalla se queda enganchada y el DVD, a veces, da error de lectura.	negative
excelente siempre que la flauta se pueda abrir en dos partes es perfecta yo la hubiese hecho mas grande y alargada . eso si para las de plastico del colegio no valen	positive
Por este precio es más que recomendable. Las instrucciones se pueden encontrar en castellano fácilmente.	positive
No funcionan. Los tendré que devolver. Además, encargué 1 y me enviaron y cobraron dos.	negative
Me ha gustado lo bien que quita la grasa y suciedad del motor, y que no ataca a la pintura ni a las gomas. Lo que menos, como siempre el precio, son solamente 500 cl. y sirve para una vez.	positive
El colchón parece duro pero al despertar tiene un duda la parte donde has dormido así que te levantas un poco con dolor moviéndote al otro lado de la cama , lo malo que una vez abierto ya no se pueden devolver	negative
Acabado muy bueno, y mi hijo super contento de tener a sus personajes favoritos en un paraguas.	positive
Me encanta. Se limpia muy facil y el acolchado es perfecto.	positive
Compra perfecta.llego en el plazo y son muy como dos y no hay problema d q se pinchen como los tradicionales.Las única pega es el espacio q ocupan en la bolsa d la piscina.X lo demás genial muy biena	positive
Buena relación calidad/precio.Muy contenta con la compra.	positive
La cámara tiene una apariencia obsoleta. Ocupa mucho espacio con la pnatalla desplegada. No tiene un manejo cómodo. En mi casa ya venía abierta por el precio no solicité la devolución.	negative
Ha llegado muy mal embalado y golpeado	negative
Me ha gustado mucho, es muy bonito. Da mucho calor. Lo pedí para mi madre para que calentará el baño y genial y yo me he comprado otro. Muy satisfecha !!	positive
Buena terminación y a un precio ajustado. Lo recomendaré.	positive
Envio muy rapido, el protector parece que esta bien, encaja bien,lo unico que he echado de menos es el molde para colocar el protector y hacerlo mas sencillo.	positive
Es práctico...el móvil pesa menos y parece mas un s9 plus...lo hace muy bonito...deberia haber mas colores	positive
El embalaje ha llegado muy defectuoso, da la impresión de ser una caja abierta y devuelta por otro comprador pegada con cinta de celo por las esquinas, si no lo necesitase para un encargo hoy lo devolvería, da casi vergüenza regalarlo así	negative
Primeras pruebas positivas. Se escucha bien y la bateria aguanta mas de lo que pensaba, 6 horas mas o menos. Os ire actualizando la opinion si algo va mal de momento bien.	positive
Muy versátil, funciona bien con Android y con pc Windows. Con ps4 no he probado.	positive
Una telaraña barata pero que cumple muy bien su función y sus características. Es muy suave y no pica, en ocasiones he comprado otras telas de araña que picaban y esta es genial.	positive
Vienen 3 rotos por la esquina. Deben haber golpeado el paquete. El producto es según se describe. Pero una pena tener 3 estropeados sin haberlo usado.	negative
Es una muñeca muy bonita, es igual que en la foto y pesa muy poco. Perfecta para niñas pequeñas	positive
Mala compra. Plástico endeble, las bandejas no se enganchan y se sueltan cuando colocas o coges la ropa.	negative
Hace tres meses estas tiras en la placa ducha, despues de estar limpiando perfectamente la superficie donde iban pegadas, darles calor con un secador para que pegaran mejor y dejarlas un finde semana sin mojar se estan despegando las tiras dejando el adhesivo pegado en la placa ducha.	negative
1 dio la usamos y no funciona , la devolvimos	negative
En cuanto a diseño y materiales es muy top, no tengo queja alguna. Yo lo voy a devolver porque la esfera de dentro es muy oscura y cuesta ver la hora (esfera negra) incluso con luz, solamente se ve bien estando a oscuras; creo que es un dato que pocos han comentado y veo necesario. La app simple y cuesta encontrarla, también es algo tardía la vinculación con bluetooth, he de añadir que por el precio que tiene no son grandes pegas. Espero que os sirva de ayuda!	negative
No recibí el vestido que se observa en la foto, he recibido otro vestido de Dream Rover de color blanco.	negative
Muy útil y practico el comprar que por el peso que te lo traigan a casa.	positive
No realiza las expectativas, no ahuyenta	negative
Compre esta funda porque tenia una de libro y con el peque se hacia incomoda. Con esta funda y un protector de cristal templado todo perfecto y protegida	positive
Segun estaba descrito el monopatin parece que viene con el asiento incluido y cuando mo abres no es asi, para mi una decepcion creo q la informacion no es correcta e induce a error.	negative
Me ha durado un mes . Se ha roto la barra plateada de el lado. Me han mandado otra en 24 horas a ver si sale más buena	negative
Se rompe y no tiene servicio de garantia. Te devuelven el dinero y si cuesta mas el nuevo lo asumes tu.	negative
El libro viene acompañado de unas cuantas cosas más dentro de una carpeta de plástico transparente. Me di cuenta que esa carpeta tenía una pegatina-sello rota, la cual sirve que al abrirlo por primera vez se rompe, por lo tanto estaba abierto de antes. Desconocía si faltaba algo, tras comprobarlo con la tutora de mi hijo, todo estaba correcto. Daba la sensación de estar usado antes.	negative
Es una mochila grande, perfecta para llevar todas las cosas del bebé, pero algo incómodo para cerrar la cremallera principal, hay que cogerle el truco.	positive
Baja calidad del plástico	negative
Muy bonitos aunque pequeños	positive
